{
  "schema_version": "1.0",
  "client_id": "acme-co",
  "last_updated_at": "2026-07-03T14:22:00Z",
  "last_updated_by": "orchestrator",
  "data": {
    "current_stage": "qa_revision",
    "blocked": false,
    "blocked_reason": null,
    "mockup_revision_round": 1,
    "mockup_revision_cap": 3,
    "qa_revision_round": 2,
    "qa_revision_cap": 2,
    "stage_history": [
      { "stage": "kickoff", "entered_at": "2026-07-01T09:00:00Z", "exited_at": "2026-07-01T09:05:00Z", "agent": "human/intake" },
      { "stage": "scraping", "entered_at": "2026-07-01T09:05:00Z", "exited_at": "2026-07-01T09:20:00Z", "agent": "scraper" }
    ]
  }
}
